{
  "plan": {
    "excluded": [],
    "query_sha256": "21f9c77f619ed361b3e4c452e451c0849d115b7c8a7abc519ce7d9a599c0a24f",
    "schema_version": "kgnote.graph-view-plan.v1",
    "selected": {
      "evidence_ids": [
        "evidence_apply_confounder",
        "evidence_counterfactual_unresolved",
        "evidence_define_correlation_causation",
        "evidence_question_correlation_causation"
      ],
      "link_ids": [
        "edge_causal_inference_counterfactual_unresolved",
        "edge_confounder_related_correlation",
        "edge_correlation_contrasts_causation",
        "edge_event_applied_confounder",
        "edge_event_asked_causation",
        "edge_event_asked_correlation",
        "edge_event_encountered_counterfactual",
        "edge_rct_related_confounder"
      ],
      "node_ids": [
        "concept_causal_inference",
        "concept_causation",
        "concept_confounder",
        "concept_correlation",
        "concept_counterfactual",
        "concept_randomized_controlled_trial",
        "event_causality_question"
      ],
      "source_ids": [
        "src_synthetic_causality_chat"
      ]
    },
    "snapshot_sha256": "f3f4ea690dea22ac5fa2f520bf0d6f4201de0e890a15458ad2d49b7fd71e060e"
  },
  "schema_version": "kgnote.graph-view-application.v1",
  "status": "ready",
  "view": {
    "evidence": [
      {
        "extraction_confidence": "high",
        "extractor_version": "manual.phase0.v1",
        "id": "evidence_apply_confounder",
        "label": "Evidence L9-L11",
        "locator": {
          "kind": "line_range",
          "value": "L9-L11"
        },
        "observed_at": null,
        "proposition": "Learner 在冰淇淋與溺水例子中提出氣溫是 confounder；Tutor 確認這次應用，但明確限制其不能證明已理解完整 causal inference。",
        "review_status": "accepted",
        "source_id": "src_synthetic_causality_chat"
      },
      {
        "extraction_confidence": "high",
        "extractor_version": "manual.phase0.v1",
        "id": "evidence_counterfactual_unresolved",
        "label": "Evidence L13-L15",
        "locator": {
          "kind": "line_range",
          "value": "L13-L15"
        },
        "observed_at": null,
        "proposition": "Learner 詢問 counterfactual 是否相關；Tutor 只回答可能相關，未提供精確 relation，因此該關係保持 unresolved。",
        "review_status": "accepted",
        "source_id": "src_synthetic_causality_chat"
      },
      {
        "extraction_confidence": "high",
        "extractor_version": "manual.phase0.v1",
        "id": "evidence_define_correlation_causation",
        "label": "Evidence L7",
        "locator": {
          "kind": "line_range",
          "value": "L7"
        },
        "observed_at": null,
        "proposition": "Tutor 區分 correlation 與 causation，並指出共同變動可能來自第三個變數。",
        "review_status": "accepted",
        "source_id": "src_synthetic_causality_chat"
      },
      {
        "extraction_confidence": "high",
        "extractor_version": "manual.phase0.v1",
        "id": "evidence_question_correlation_causation",
        "label": "Evidence L5",
        "locator": {
          "kind": "line_range",
          "value": "L5"
        },
        "observed_at": null,
        "proposition": "Learner 詢問冰淇淋銷量與溺水人數共同上升是否代表因果，並明確表示分不清 correlation 與 causation。",
        "review_status": "accepted",
        "source_id": "src_synthetic_causality_chat"
      }
    ],
    "filter_facets": {
      "edge_classes": [
        "canonical",
        "learning",
        "soft_association"
      ],
      "node_kinds": [
        "concept",
        "learning_event"
      ],
      "relations": [
        "applied",
        "asked_about",
        "contrasts_with",
        "encountered",
        "related_to"
      ],
      "spaces": [
        "causal-inference"
      ]
    },
    "links": [
      {
        "confidence": "unresolved",
        "edge_class": "soft_association",
        "evidence_ids": [
          "evidence_counterfactual_unresolved"
        ],
        "id": "edge_causal_inference_counterfactual_unresolved",
        "relation": null,
        "source_id": "concept_causal_inference",
        "target_id": "concept_counterfactual"
      },
      {
        "confidence": "high",
        "edge_class": "canonical",
        "evidence_ids": [
          "evidence_apply_confounder",
          "evidence_define_correlation_causation"
        ],
        "id": "edge_confounder_related_correlation",
        "relation": "related_to",
        "source_id": "concept_confounder",
        "target_id": "concept_correlation"
      },
      {
        "confidence": "high",
        "edge_class": "canonical",
        "evidence_ids": [
          "evidence_define_correlation_causation"
        ],
        "id": "edge_correlation_contrasts_causation",
        "relation": "contrasts_with",
        "source_id": "concept_correlation",
        "target_id": "concept_causation"
      },
      {
        "confidence": "high",
        "edge_class": "learning",
        "evidence_ids": [
          "evidence_apply_confounder"
        ],
        "id": "edge_event_applied_confounder",
        "relation": "applied",
        "source_id": "event_causality_question",
        "target_id": "concept_confounder"
      },
      {
        "confidence": "high",
        "edge_class": "learning",
        "evidence_ids": [
          "evidence_question_correlation_causation"
        ],
        "id": "edge_event_asked_causation",
        "relation": "asked_about",
        "source_id": "event_causality_question",
        "target_id": "concept_causation"
      },
      {
        "confidence": "high",
        "edge_class": "learning",
        "evidence_ids": [
          "evidence_question_correlation_causation"
        ],
        "id": "edge_event_asked_correlation",
        "relation": "asked_about",
        "source_id": "event_causality_question",
        "target_id": "concept_correlation"
      },
      {
        "confidence": "high",
        "edge_class": "learning",
        "evidence_ids": [
          "evidence_counterfactual_unresolved"
        ],
        "id": "edge_event_encountered_counterfactual",
        "relation": "encountered",
        "source_id": "event_causality_question",
        "target_id": "concept_counterfactual"
      },
      {
        "confidence": "high",
        "edge_class": "canonical",
        "evidence_ids": [
          "evidence_apply_confounder"
        ],
        "id": "edge_rct_related_confounder",
        "relation": "related_to",
        "source_id": "concept_randomized_controlled_trial",
        "target_id": "concept_confounder"
      }
    ],
    "nodes": [
      {
        "aliases": [
          "因果推論"
        ],
        "evidence_ids": [
          "evidence_apply_confounder"
        ],
        "id": "concept_causal_inference",
        "kind": "concept",
        "label": "Causal inference",
        "spaces": [
          "causal-inference"
        ],
        "status": "needs_review",
        "summary": "根據資料與假設推論因果關係的研究問題。"
      },
      {
        "aliases": [
          "因果關係"
        ],
        "evidence_ids": [
          "evidence_define_correlation_causation",
          "evidence_question_correlation_causation"
        ],
        "id": "concept_causation",
        "kind": "concept",
        "label": "Causation",
        "spaces": [
          "causal-inference"
        ],
        "status": "active",
        "summary": "主張一個變數的變化造成另一個變數的變化。"
      },
      {
        "aliases": [
          "混淆變數"
        ],
        "evidence_ids": [
          "evidence_apply_confounder",
          "evidence_define_correlation_causation"
        ],
        "id": "concept_confounder",
        "kind": "concept",
        "label": "Confounder",
        "spaces": [
          "causal-inference"
        ],
        "status": "active",
        "summary": "同時影響所觀察變數、可能造成表面相關的第三個變數。"
      },
      {
        "aliases": [
          "相關"
        ],
        "evidence_ids": [
          "evidence_define_correlation_causation",
          "evidence_question_correlation_causation"
        ],
        "id": "concept_correlation",
        "kind": "concept",
        "label": "Correlation",
        "spaces": [
          "causal-inference"
        ],
        "status": "active",
        "summary": "兩個變數呈現共同變動，但本身不主張因果方向。"
      },
      {
        "aliases": [
          "反事實"
        ],
        "evidence_ids": [
          "evidence_counterfactual_unresolved"
        ],
        "id": "concept_counterfactual",
        "kind": "concept",
        "label": "Counterfactual",
        "spaces": [
          "causal-inference"
        ],
        "status": "needs_review",
        "summary": "本 fixture 只記錄它被詢問；定義及與因果推論的精確關係尚無足夠 evidence。"
      },
      {
        "aliases": [
          "RCT",
          "隨機對照試驗"
        ],
        "evidence_ids": [
          "evidence_apply_confounder"
        ],
        "id": "concept_randomized_controlled_trial",
        "kind": "concept",
        "label": "Randomized controlled trial",
        "spaces": [
          "causal-inference"
        ],
        "status": "active",
        "summary": "使用隨機分派降低組別間系統性混淆的研究設計。"
      },
      {
        "concept_ids": [
          "concept_causal_inference",
          "concept_causation",
          "concept_confounder",
          "concept_correlation",
          "concept_counterfactual",
          "concept_randomized_controlled_trial"
        ],
        "context": "synthetic-causality-chat lines L5-L15; learner asks about correlation and causation, then applies confounder to the example",
        "event_type": "question",
        "evidence_ids": [
          "evidence_apply_confounder",
          "evidence_counterfactual_unresolved",
          "evidence_define_correlation_causation",
          "evidence_question_correlation_causation"
        ],
        "id": "event_causality_question",
        "kind": "learning_event",
        "label": "Question event",
        "occurred_at": null,
        "source_ids": [
          "src_synthetic_causality_chat"
        ]
      }
    ],